{
  "id": "is_mahkemeleri_m3",
  "kind": "kanun",
  "shortTitle": "İş Mahk. K. m. 3",
  "fullTitle": "7036 sayılı İş Mahkemeleri Kanunu — Madde 3: Dava şartı olarak arabuluculuk",
  "body": "Kanuna, bireysel veya toplu iş sözleşmesine dayanan işçi veya işveren alacağı ve tazminatı ile işe iade talebiyle açılan davalarda, arabulucuya başvurulmuş olması dava şartıdır. Arabulucuya başvurulmadan dava açıldığının anlaşılması hâlinde herhangi bir işlem yapılmaksızın davanın, dava şartı yokluğu sebebiyle usulden reddine karar verilir.",
  "url": "https://www.mevzuat.gov.tr/mevzuat?MevzuatNo=7036&MevzuatTur=1",
  "verifiedAt": "2026-01-01",
  "verifier": "LawKit içerik ekibi"
}
