{
  "id": "is_kanunu_m20",
  "kind": "kanun",
  "shortTitle": "İş K. m. 20",
  "fullTitle": "4857 sayılı İş Kanunu — Madde 20: Fesih bildirimine itiraz ve usulü",
  "body": "İş sözleşmesi feshedilen işçi, fesih bildiriminde sebep gösterilmediği veya gösterilen sebebin geçerli bir sebep olmadığı iddiası ile fesih bildiriminin tebliği tarihinden itibaren bir ay içinde işe iade talebiyle, İş Mahkemeleri Kanunu hükümleri uyarınca arabulucuya başvurmak zorundadır. Arabuluculuk faaliyeti sonunda anlaşmaya varılamaması hâlinde, son tutanağın düzenlendiği tarihten itibaren iki hafta içinde iş mahkemesinde dava açabilir.",
  "url": "https://www.mevzuat.gov.tr/mevzuat?MevzuatNo=4857&MevzuatTur=1",
  "verifiedAt": "2026-01-01",
  "verifier": "LawKit içerik ekibi"
}
